工廠名稱,工廠市鎮鄉村里,工廠組織型態,工廠登記核准年分,工廠登記狀態,產業類別,主要產品
陳阿明企業有限公司安定廠,臺南市安定區六嘉里,有限公司,109年,生產中,25金屬製品製造業,259其他金屬製品
和陽食品企業股份有限公司柳營廠,臺南市柳營區八翁里,股份有限公司,109年,生產中,08食品製造業、09飲料製造業,089其他食品、092非酒精飲料
亞太竑科技有限公司,新竹縣芎林鄉秀湖村,有限公司,109年,生產中,29機械設備製造業、29機械設備製造業,292其他專用機械設備
冠承工業有限公司,臺中市潭子區潭秀里,有限公司,109年,生產中,25金屬製品製造業、31其他運輸工具及其零件製造業,259其他金屬製品、313自行車及其零件
智惠科技開發股份有限公司,新北市樹林區圳生里,有限公司,93年,生產中,25金屬製品製造業、29機械設備製造業,259其他金屬製品、293通用機械設備、251金屬刀具、手工具及模具
才興精密機械廠,臺南市永康區?行里,獨資,88年,生產中,25金屬製品製造業、29機械設備製造業,259其他金屬製品、293通用機械設備
日皓造紙工業股份有限公司觀音廠,桃園市觀音區樹林里,股份有限公司,86年,生產中,15紙漿、紙及紙製品製造業,151紙漿、紙、紙板
竣豐建材實業,臺南市安定區中沙里,合夥,109年,生產中,23非金屬礦物製品製造業,232耐火、黏土建材及其他陶瓷製品
維兒企業有限公司,臺南市安定區新吉里,有限公司,109年,生產中,29機械設備製造業,292其他專用機械設備
振暘有限公司,臺南市麻豆區寮?里,有限公司,110年,生產中,25金屬製品製造業,259其他金屬製品
啟銨工業股份有限公司,彰化縣北斗鎮中寮里,股份有限公司,109年,生產中,25金屬製品製造業,259其他金屬製品
冠利有限公司新營廠,臺南市新營區太北里,有限公司,109年,生產中,08食品製造業,083蔬果加工
誠泰國際食品有限公司,桃園市蘆竹區內厝里,有限公司,109年,生產中,08食品製造業,089其他食品
遠通氣密窗有限公司蘆竹廠,桃園市蘆竹區海湖里,股份有限公司,81年,生產中,25金屬製品製造業,252金屬結構及建築組件
誠品科技實業有限公司,臺中市神岡區豐洲里,有限公司,108年,生產中,22塑膠製品製造業,220塑膠製品
葉義興企業股份有限公司,嘉義縣竹崎鄉灣橋村,股份有限公司,93年,生產中,33其他製造業,339未分類其他製品
連乙鑄造股份有限公司二廠,臺中市大甲區日南里,股份有限公司,96年,生產中,25金屬製品製造業,254金屬加工處理
一協茂鐵網有限公司,臺中市潭子區大富里,有限公司,109年,生產中,25金屬製品製造業,259其他金屬製品
臺中市潭子區農會碾米廠,臺中市潭子區東寶里,農會組織,109年,生產中,08食品製造業,086碾榖、磨粉及澱粉製品
龍漳企業有限公司,彰化縣秀水鄉安溪村,有限公司,109年,生產中,22塑膠製品製造業,220塑膠製品
重新傷殘用具製造廠有限公司,新北市新莊區興漢里,有限公司,59年,生產中,33其他製造業,332醫療器材及用品
介隆興齒輪股份有限公司梓官廠,高雄市梓官區梓平里,股份有限公司,83年,生產中,25金屬製品製造業、29機械設備製造業、30汽車及其零件製造業、31其他運輸工具及其零件製造業,259其他金屬製品、293通用機械設備、303汽車零件、312機車及其零件
安泰汽車興業股份有限公司,桃園市蘆竹區內厝里,股份有限公司,94年,生產中,30汽車及其零件製造業,303汽車零件
均緯科技有限公司,臺南市仁德區太子里,有限公司,109年,生產中,29機械設備製造業,293通用機械設備
俊凱科技有限公司,臺南市永康區?洲里,有限公司,103年,生產中,25金屬製品製造業,251金屬刀具、手工具及模具
元裕陶瓷工業社,新北市鶯歌區鳳祥里,獨資,81年,生產中,23非金屬礦物製品製造業,232耐火、黏土建材及其他陶瓷製品
泰錡金屬工程有限公司苑裡廠,苗栗縣苑裡鎮社苓里,有限公司,107年,生產中,25金屬製品製造業,254金屬加工處理
總盈汽車股份有限公司一廠,臺南市永康區三民里,股份有限公司,108年,生產中,28電力設備及配備製造業,289其他電力設備及配備
利宏興業有限公司,新北市新莊區國泰里,有限公司,109年,生產中,08食品製造業,089其他食品
嘉美行,高雄市田寮區西德里,合夥,109年,生產中,14木竹製品製造業,140木竹製品
豪億企業股份有限公司,高雄市湖內區太爺里,股份有限公司,84年,生產中,25金屬製品製造業,254金屬加工處理、259其他金屬製品
鍱德股份有限公司,桃園市觀音區廣興里,股份有限公司,99年,生產中,22塑膠製品製造業,220塑膠製品
晉升機械工程有限公司,高雄市大寮區江山里,有限公司,109年,生產中,29機械設備製造業,293通用機械設備
實安國際有限公司,新北市新莊區福營里,有限公司,110年,生產中,22塑膠製品製造業,220塑膠製品
佶優科技股份有限公司,新北市土城區沛陂里,股份有限公司,79年,生產中,22塑膠製品製造業,220塑膠製品
吉光片羽股份有限公司,新北市中和區碧河里,股份有限公司,109年,生產中,08食品製造業,089其他食品
鉅烽科技股份有限公司,臺中市潭子區栗林里,有限公司,95年,生產中,25金屬製品製造業、29機械設備製造業,251金屬刀具、手工具及模具、259其他金屬製品、291金屬加工用機械設備
立匯工業有限公司四廠,臺南市仁德區仁義里,有限公司,109年,生產中,33其他製造業,331育樂用品
榮茂生物科技有限公司,彰化縣溪湖鎮媽厝里,有限公司,110年,生產中,18化學材料及肥料製造業,183肥料及氮化合物
世杰實業有限公司,新北市新莊區化成里,有限公司,76年,生產中,29機械設備製造業、25金屬製品製造業、28電力設備及配備製造業,284照明設備及配備、285家用電器、293通用機械設備、251金屬刀具、手工具及模具
互建紙器有限公司,高雄市仁武區考潭里,有限公司,109年,生產中,15紙漿、紙及紙製品製造業,152瓦楞紙板及紙容器
傑茉尼斯國際有限公司,臺中市大里區瑞城里,有限公司,110年,生產中,25金屬製品製造業、29機械設備製造業、30汽車及其零件製造業、31其他運輸工具及其零件製造業,251金屬刀具、手工具及模具、293通用機械設備、303汽車零件、312機車及其零件、313自行車及其零件
英騰吉德科技股份有限公司,桃園市桃園區大林里,股份有限公司,109年,生產中,21橡膠製品製造業,210橡膠製品
傑懋國際股份有限公司,屏東縣新園鄉新園村,股份有限公司,107年,生產中,29機械設備製造業,291金屬加工用機械設備、292其他專用機械設備、293通用機械設備
展訊精密工業股份有限公司,桃園市八德區大安里,股份有限公司,108年,生產中,27電腦、電子產品及光學製品製造業、25金屬製品製造業,271電腦及其週邊設備、254金屬加工處理
長芯企業有限公司,桃園市中壢區三民里,有限公司,77年,生產中,25金屬製品製造業、29機械設備製造業、30汽車及其零件製造業、33其他製造業,252金屬結構及建築組件、259其他金屬製品、293通用機械設備、303汽車零件、331育樂用品
吉利米血,屏東縣鹽埔鄉鹽中村,獨資,109年,生產中,08食品製造業,089其他食品
紘晟實業有限公司,彰化縣永靖鄉湳港村,有限公司,109年,生產中,25金屬製品製造業,259其他金屬製品
金曄軒機械股份有限公司,桃園市楊梅區雙榮里,股份有限公司,78年,生產中,25金屬製品製造業、29機械設備製造業、33其他製造業,259其他金屬製品、293通用機械設備、331育樂用品
釆鑫科技股份有限公司大園二廠,桃園市大園區內海里,股份有限公司,101年,生產中,25金屬製品製造業,254金屬加工處理、259其他金屬製品
哲在基礎營造工程有限公司工廠,彰化縣彰化市東芳里,有限公司,109年,生產中,25金屬製品製造業,252金屬結構及建築組件、254金屬加工處理
金萬誠有限公司,高雄市路竹區竹東里,有限公司,91年,生產中,25金屬製品製造業,259其他金屬製品
永傳飼料廠,雲林縣虎尾鎮西屯里,獨資,109年,生產中,08食品製造業,087動物飼品
富昕工業有限公司,臺中市太平區太平里,有限公司,92年,生產中,25金屬製品製造業、29機械設備製造業、31其他運輸工具及其零件製造業,259其他金屬製品、293通用機械設備、313自行車及其零件
顯彰企業有限公司二廠,彰化縣鹿港鎮廖厝里,有限公司,109年,生產中,25金屬製品製造業、29機械設備製造業,259其他金屬製品、293通用機械設備
和盈精密有限公司,高雄市路竹區社南里,有限公司,104年,生產中,25金屬製品製造業,259其他金屬製品
華新皮件有限公司,彰化縣彰化市國聖里,有限公司,109年,生產中,13皮革、毛皮及其製品製造業,130皮革、毛皮及其製品
嘉呈興業股份有限公司,新竹縣新豐鄉中崙村,股份有限公司,109年,生產中,25金屬製品製造業、25金屬製品製造業、30汽車及其零件製造業、31其他運輸工具及其零件製造業,259其他金屬製品、303汽車零件、312機車及其零件
瑞基海洋生物科技股份有限公司科雅廠,臺中市大雅區,股份有限公司,110年,生產中,33其他製造業,332醫療器材及用品
金旺來工業股份有限公司,嘉義縣民雄鄉大崎村,股份有限公司,75年,生產中,25金屬製品製造業,253金屬容器
誠兌工業股份有限公司二廠,高雄市大寮區上寮里,股份有限公司,109年,生產中,25金屬製品製造業,259其他金屬製品
達鋼馨餐飲設備顧問有限公司,新北市樹林區三多里,有限公司,106年,生產中,25金屬製品製造業、29機械設備製造業、32家具製造業,259其他金屬製品、293通用機械設備、322金屬家具
成泰生物科技有限公司中和廠,新北市中和區,有限公司,107年,生產中,08食品製造業,089其他食品
?豐企業有限公司,高雄市仁武區竹後里,有限公司,90年,生產中,24基本金屬製造業、25金屬製品製造業,241鋼鐵、252金屬結構及建築組件
信豪彩色印刷有限公司,臺北市士林區社新里,有限公司,109年,生產中,16印刷及資料儲存媒體複製業,160印刷及資料儲存媒體複製
鼎饌食品有限公司,基隆市七堵區六堵里,有限公司,99年,生產中,08食品製造業,089其他食品
吉盈織造有限公司歸仁廠,臺南市歸仁區七甲里,有限公司,109年,生產中,11紡織業,115紡織品
程華工業股份有限公司二廠,高雄市燕巢區安招里,股份有限公司,109年,生產中,25金屬製品製造業,259其他金屬製品
達成塑膠有限公司,苗栗縣苑裡鎮田心里,有限公司,109年,生產中,22塑膠製品製造業、22塑膠製品製造業,220塑膠製品
凱桀精密工業股份有限公司一廠,臺中市大里區夏田里,股份有限公司,109年,生產中,27電腦、電子產品及光學製品製造業、31其他運輸工具及其零件製造業,277光學儀器及設備、313自行車及其零件
森兆生醫股份有限公司,新北市新店區復興里,股份有限公司,110年,生產中,20藥品及醫用化學製品製造業,200藥品及醫用化學製品
荃宥工程行工廠,彰化縣埤頭鄉豐崙村,獨資,109年,生產中,25金屬製品製造業,252金屬結構及建築組件、254金屬加工處理
峰光精密工業有限公司,臺中市神岡區岸裡里,有限公司,68年,生產中,25金屬製品製造業,251金屬刀具、手工具及模具
東檉企業有限公司豐原廠,臺中市豐原區鎌村里,有限公司,109年,生產中,29機械設備製造業,293通用機械設備
山華企業股份有限公司九如廠,屏東縣九如鄉東寧村,股份有限公司,91年,生產中,12成衣及服飾品製造業,121成衣
鴻鑫五金企業社,高雄市岡山區嘉興里,獨資,109年,生產中,25金屬製品製造業,259其他金屬製品
久慶國際船業股份有限公司總廠,高雄市茄萣區崎漏里,股份有限公司,109年,生產中,31其他運輸工具及其零件製造業、31其他運輸工具及其零件製造業,311船舶及浮動設施
立弓膠業有限公司,宜蘭縣冬山鄉廣興村,有限公司,109年,生產中,29機械設備製造業、22塑膠製品製造業、21橡膠製品製造業,293通用機械設備、220塑膠製品、210橡膠製品
久大興企業有限公司,臺中市烏日區溪埧里,有限公司,109年,生產中,29機械設備製造業,292其他專用機械設備
勝固亞實業有限公司二廠,臺中市烏日區北里里,有限公司,109年,生產中,25金屬製品製造業、25金屬製品製造業,254金屬加工處理
金奕達企業有限公司一廠,雲林縣麥寮鄉興華村,有限公司,109年,生產中,25金屬製品製造業,259其他金屬製品
漢佳音科技股份有限公司,臺南市仁德區保安里,股份有限公司,109年,生產中,25金屬製品製造業,253金屬容器、259其他金屬製品
優盛醫學科技股份有限公司內湖廠,臺北市內湖區港墘里,股份有限公司,89年,生產中,27電腦、電子產品及光學製品製造業,272通訊傳播設備、276輻射及電子醫學設備
正隆工業股份有限公司,臺北市南港區合成里,股份有限公司,64年,生產中,29機械設備製造業、33其他製造業、30汽車及其零件製造業,293通用機械設備、339未分類其他製品、302車體
鑫優股份有限公司,臺中市烏日區東園里,股份有限公司,109年,生產中,25金屬製品製造業,259其他金屬製品
台殷實業股份有限公司桃園廠,桃園市龜山區南上里,股份有限公司,71年,生產中,14木竹製品製造業,140木竹製品
稻香工業股份有限公司二廠,臺中市大雅區員林里,股份有限公司,109年,生產中,25金屬製品製造業,259其他金屬製品
佳家食品廠,臺中市大雅區員林里,獨資,109年,生產中,08食品製造業,089其他食品
證相工業有限公司,臺中市大雅區秀山里,有限公司,109年,生產中,25金屬製品製造業,251金屬刀具、手工具及模具、254金屬加工處理
台達企業社,新北市新莊區西盛里,獨資,95年,生產中,26電子零組件製造業,264光電材料及元件、269其他電子零組件
猛達工業股份有限公司二廠,彰化縣埔鹽鄉南新村,股份有限公司,109年,生產中,25金屬製品製造業,251金屬刀具、手工具及模具
金吉士有限公司,高雄市大寮區會結里,有限公司,108年,生產中,09飲料製造業,092非酒精飲料
日紅實業股份有限公司二廠,桃園市龜山區兔坑里,股份有限公司,83年,生產中,11紡織業,114染整
百豐傳牧場,臺南市麻豆區北勢里,獨資,109年,生產中,08食品製造業,081肉類加工
東鎮精機股份有限公司,新北市三重區中興里,股份有限公司,71年,生產中,29機械設備製造業、25金屬製品製造業、28電力設備及配備製造業,259其他金屬製品、293通用機械設備、291金屬加工用機械設備、251金屬刀具、手工具及模具、283電線及配線器材、289其他電力設備及配備
隆得興實業有限公司,臺中市大里區日新里,有限公司,109年,生產中,25金屬製品製造業,252金屬結構及建築組件
誼田工業股份有限公司,新北市新莊區西盛里,股份有限公司,109年,生產中,30汽車及其零件製造業、31其他運輸工具及其零件製造業,303汽車零件、312機車及其零件
鑫茂實業有限公司,臺中市大里區金城里,有限公司,109年,生產中,16印刷及資料儲存媒體複製業,160印刷及資料儲存媒體複製
金翊勝精密工業有限公司,新北市新莊區西盛里,有限公司,109年,生產中,25金屬製品製造業,251金屬刀具、手工具及模具
百納康健生技股份有限公司,臺中市西屯區協和里,股份有限公司,101年,生產中,09飲料製造業,092非酒精飲料
聯翔汽車有限公司(斗南廠),雲林縣斗南鎮小東里,有限公司,109年,生產中,30汽車及其零件製造業,303汽車零件
詠慶鋼鐵有限公司,嘉義縣民雄鄉大崎村,有限公司,109年,生產中,25金屬製品製造業,254金屬加工處理
凱柏登實業股份有限公司,嘉義縣民雄鄉福權村,股份有限公司,109年,生產中,32家具製造業,321非金屬家具
振楠交通工程有限公司鹿港廠,彰化縣鹿港鎮洋厝里,有限公司,109年,生產中,22塑膠製品製造業,220塑膠製品
庚鋐有限公司二廠,彰化縣秀水鄉馬興村,有限公司,109年,生產中,22塑膠製品製造業、33其他製造業、32家具製造業、31其他運輸工具及其零件製造業,220塑膠製品、331育樂用品、321非金屬家具、313自行車及其零件
久皇機械股份有限公司,彰化縣秀水鄉莊雅村,股份有限公司,109年,生產中,25金屬製品製造業,253金屬容器
輝吉企業有限公司,彰化縣秀水鄉安溪村,有限公司,109年,生產中,30汽車及其零件製造業、31其他運輸工具及其零件製造業,303汽車零件、312機車及其零件
金勝發衛浴實業有限公司,彰化縣鹿港鎮廖厝里,有限公司,109年,生產中,25金屬製品製造業,259其他金屬製品
全侑企業社,新北市樹林區坡內里,獨資,109年,生產中,11紡織業,111紡紗
高軒企業股份有限公司(一廠),雲林縣斗南鎮將軍里,股份有限公司,109年,生產中,25金屬製品製造業,252金屬結構及建築組件
美帥化學股份有限公司,臺南市南區彰南里,股份有限公司,107年,生產中,19其他化學製品製造業,193清潔用品及化粧品
鈦原消防工業有限公司,高雄市仁武區竹後里,有限公司,110年,生產中,29機械設備製造業,293通用機械設備
佳南實業社,臺南市新化區唪口里,獨資,109年,生產中,11紡織業,111紡紗
雲晉紡織股份有限公司,彰化縣線西鄉寓埔村,股份有限公司,73年,生產中,11紡織業,112織布
泰勝機械股份有限公司二廠,彰化縣和美鎮嘉寶里,股份有限公司,109年,生產中,29機械設備製造業,292其他專用機械設備
玖貿企業股份有限公司二廠,彰化縣花壇鄉橋頭村,股份有限公司,109年,生產中,25金屬製品製造業,259其他金屬製品
峪豐機械工業股份有限公司,臺南市安南區布袋里,股份有限公司,109年,生產中,29機械設備製造業,292其他專用機械設備
益壯企業有限公司,新北市新莊區福基里,有限公司,93年,生產中,25金屬製品製造業,251金屬刀具、手工具及模具
生隆企業社,高雄市阿蓮區青旗里,合夥,109年,生產中,25金屬製品製造業,259其他金屬製品
員林正泰鋼鐵行,彰化縣員林市三條里,獨資,109年,生產中,25金屬製品製造業,252金屬結構及建築組件
富山企業行,高雄市湖內區海埔里,合夥,109年,生產中,08食品製造業,087動物飼品
力尹食品有限公司,新北市汐止區中興里,有限公司,102年,生產中,08食品製造業,089其他食品
長鎰織帶有限公司,彰化縣伸港鄉定興村,有限公司,109年,生產中,11紡織業,115紡織品
旺暉螺絲企業有限公司,新北市板橋區成和里,有限公司,109年,生產中,25金屬製品製造業,259其他金屬製品
明宏塑膠有限公司,彰化縣二林鎮頂厝里,有限公司,69年,生產中,22塑膠製品製造業,220塑膠製品
俊鳴精密工業股份有限公司,新北市新莊區化成里,股份有限公司,100年,生產中,25金屬製品製造業、29機械設備製造業,251金屬刀具、手工具及模具、259其他金屬製品、293通用機械設備
江陵機電股份有限公司楊梅五廠-木工廠,桃園市楊梅區高山里,股份有限公司,109年,生產中,14木竹製品製造業、32家具製造業,140木竹製品、321非金屬家具
上順水泥製品企業股份有限公司二廠,高雄市大寮區潮寮里,股份有限公司,109年,生產中,23非金屬礦物製品製造業,239其他非金屬礦物製品
漢民測試系統股份有限公司,新竹市東區埔頂里,股份有限公司,98年,生產中,29機械設備製造業,292其他專用機械設備
復盛精密工業股份有限公司竹科一廠,新竹縣寶山鄉,股份有限公司,90年,生產中,26電子零組件製造業、25金屬製品製造業,269其他電子零組件、254金屬加工處理
鋒運實業有限公司,新北市三重區永福里,有限公司,109年,生產中,25金屬製品製造業,251金屬刀具、手工具及模具、259其他金屬製品
建璋機械工程有限公司一廠,高雄市林園區文賢里,有限公司,109年,生產中,25金屬製品製造業,254金屬加工處理
凱撒床業股份有限公司,彰化縣埔鹽鄉瓦村,股份有限公司,97年,生產中,32家具製造業,321非金屬家具
中國化學製藥股份有限公司新豐工廠,新竹縣新豐鄉上坑村,股份有限公司,86年,生產中,20藥品及醫用化學製品製造業,200藥品及醫用化學製品
德乙企業股份有限公司,基隆市安樂區內寮里,股份有限公司,103年,生產中,30汽車及其零件製造業、30汽車及其零件製造業、33其他製造業,303汽車零件、332醫療器材及用品
泰癸車業有限公司二廠,彰化縣芬園鄉溪頭村,有限公司,102年,生產中,31其他運輸工具及其零件製造業,313自行車及其零件
巨昊科技股份有限公司仁德廠,臺南市仁德區仁義里,股份有限公司,109年,生產中,29機械設備製造業,293通用機械設備
鈿峰工業股份有限公司二廠,高雄市大寮區後庄里,股份有限公司,109年,生產中,25金屬製品製造業,252金屬結構及建築組件
協治企業股份有限公司新營廠,臺南市新營區太北里,股份有限公司,109年,生產中,22塑膠製品製造業,220塑膠製品
永大木箱行,桃園市龜山區福源里,獨資,109年,生產中,14木竹製品製造業,140木竹製品
遠泰金屬實業有限公司,臺中市太平區宜欣里,有限公司,109年,生產中,25金屬製品製造業,251金屬刀具、手工具及模具、259其他金屬製品
天利工業有限公司秀水廠,彰化縣秀水鄉義興村,有限公司,110年,生產中,25金屬製品製造業,259其他金屬製品
明炫精密化學股份有限公司台南廠,臺南市柳營區大農里,股份有限公司,102年,生產中,18化學材料及肥料製造業、19其他化學製品製造業、23非金屬礦物製品製造業,181化學原材料、199未分類其他化學製品、239其他非金屬礦物製品
施新和織帶有限公司,彰化縣和美鎮嘉寶里,有限公司,109年,生產中,11紡織業,115紡織品
崇濬科技股份有限公司竹南廠,苗栗縣竹南鎮大厝里,股份有限公司,109年,生產中,28電力設備及配備製造業,289其他電力設備及配備
良宇工業有限公司,苗栗縣頭份市蘆竹里,有限公司,109年,生產中,25金屬製品製造業,251金屬刀具、手工具及模具
共群有限公司,臺中市太平區太平里,有限公司,106年,生產中,25金屬製品製造業,251金屬刀具、手工具及模具、259其他金屬製品
兆億實業有限公司,彰化縣和美鎮南佃里,有限公司,109年,生產中,22塑膠製品製造業,220塑膠製品
連進捲門工程有限公司,桃園市平鎮區東勢里,有限公司,111年,生產中,25金屬製品製造業,252金屬結構及建築組件
任城有限公司工廠,彰化縣埔鹽鄉好修村,有限公司,109年,生產中,25金屬製品製造業,252金屬結構及建築組件
中濱企業股份有限公司,高雄市楠梓區稔田里,股份有限公司,109年,生產中,29機械設備製造業,292其他專用機械設備
易?金屬材料有限公司,桃園市龍潭區烏林里,有限公司,105年,生產中,25金屬製品製造業,254金屬加工處理
大河科技有限公司,臺南市善化區小新里,有限公司,109年,生產中,29機械設備製造業,292其他專用機械設備
豐年豐和企業股份有限公司上崙二廠,臺南市仁德區上崙里,股份有限公司,82年,生產中,08食品製造業,086碾榖、磨粉及澱粉製品、089其他食品
中國鋼鐵結構股份有限公司官田二廠,臺南市官田區二鎮里,股份有限公司,109年,生產中,25金屬製品製造業,252金屬結構及建築組件
譯倫工業有限公司,臺中市太平區太平里,有限公司,95年,生產中,25金屬製品製造業、29機械設備製造業,251金屬刀具、手工具及模具、259其他金屬製品、293通用機械設備
台灣日華化學工業股份有限公司,桃園市觀音區大潭里,股份有限公司,101年,生產中,19其他化學製品製造業,199未分類其他化學製品
巧莨興業有限公司,彰化縣鹿港鎮海埔里,有限公司,102年,生產中,11紡織業,115紡織品
東鉦益興業有限公司,新北市樹林區南園里,有限公司,109年,生產中,16印刷及資料儲存媒體複製業,160印刷及資料儲存媒體複製
僑福印染股份有限公司,桃園市龜山區兔坑里,股份有限公司,80年,生產中,11紡織業、16印刷及資料儲存媒體複製業,114染整、160印刷及資料儲存媒體複製
大富金屬有限公司,高雄市燕巢區橫山里,有限公司,99年,生產中,25金屬製品製造業,254金屬加工處理
