高屏預拌混凝土有限公司,高雄市美濃區中圳里,有限公司,83年,生產中,23非金屬礦物製品製造業,233水泥及其製品
高精實業有限公司,臺南市仁德區新田里,有限公司,103年,生產中,16印刷及資料儲存媒體複製業,160印刷及資料儲存媒體複製
益力康生物科技有限公司,臺南市南區彰南里,有限公司,97年,生產中,08食品製造業,089其他食品
亞仕達科技股份有限公司,新北市土城區沛陂里,股份有限公司,109年,生產中,27電腦、電子產品及光學製品製造業,271電腦及其週邊設備
豐譯企業社嘉華廠,高雄市岡山區嘉興里,獨資,109年,生產中,25金屬製品製造業,254金屬加工處理
顯阜石材有限公司,高雄市湖內區海山里,有限公司,109年,生產中,23非金屬礦物製品製造業,234石材製品
好得壯實業股份有限公司桃園廠,桃園市楊梅區頭湖里,股份有限公司,108年,生產中,08食品製造業,081肉類加工、082水產加工、083蔬果加工、089其他食品
艾達生物科技有限公司,臺中市大里區仁德里,有限公司,109年,生產中,08食品製造業,089其他食品
真廣工業股份有限公司,臺中市潭子區潭陽里,股份有限公司,110年,生產中,32家具製造業,322金屬家具
山上企業行,高雄市大寮區大寮里,合夥,109年,生產中,08食品製造業,081肉類加工
卡司通開發股份有限公司台中廠,臺中市梧棲區草湳里,股份有限公司,100年,生產中,25金屬製品製造業、29機械設備製造業、30汽車及其零件製造業,259其他金屬製品、293通用機械設備、303汽車零件
慶岱機電工業有限公司二廠,臺中市梧棲區興農里,有限公司,109年,生產中,29機械設備製造業,291金屬加工用機械設備、292其他專用機械設備
遠慶紙器有限公司,屏東縣萬丹鄉上村村,有限公司,109年,生產中,15紙漿、紙及紙製品製造業,152瓦楞紙板及紙容器
偉誠實業社,臺南市歸仁區媽廟里,合夥,109年,生產中,25金屬製品製造業,254金屬加工處理
中大鋁業行,桃園市中壢區忠義里,獨資,109年,生產中,25金屬製品製造業,252金屬結構及建築組件
台灣慧穎機械工業股份有限公司,臺中市豐原區社皮里,股份有限公司,109年,生產中,25金屬製品製造業、29機械設備製造業,259其他金屬製品、293通用機械設備
琉新工業有限公司,彰化縣永靖鄉敦厚村,有限公司,111年,生產中,25金屬製品製造業,259其他金屬製品
朝安科技股份有限公司二廠,臺中市豐原區西湳里,股份有限公司,109年,生產中,22塑膠製品製造業、33其他製造業,220塑膠製品、339未分類其他製品
尚德有限公司,新北市樹林區金寮里,有限公司,85年,生產中,25金屬製品製造業,254金屬加工處理
卜赫馬有限公司,臺中市大安區海墘里,有限公司,109年,生產中,31其他運輸工具及其零件製造業,313自行車及其零件
弘享工業股份有限公司,臺中市豐原區朴子里,股份有限公司,109年,生產中,29機械設備製造業,291金屬加工用機械設備、292其他專用機械設備、293通用機械設備
宏宇金屬建材股份有限公司,桃園市蘆竹區山腳里,股份有限公司,59年,生產中,25金屬製品製造業,254金屬加工處理、259其他金屬製品
千賀機械有限公司大富廠,臺中市神岡區三角里,有限公司,109年,生產中,29機械設備製造業、29機械設備製造業,291金屬加工用機械設備、292其他專用機械設備
三元工程行,宜蘭縣三星鄉大洲村,合夥,109年,生產中,25金屬製品製造業,252金屬結構及建築組件
嘉裕股份有限公司中壢成衣工廠,桃園市楊梅區雙榮里,股份有限公司,73年,生產中,12成衣及服飾品製造業,121成衣
維恩行,臺南市仁德區仁義里,獨資,109年,生產中,29機械設備製造業,293通用機械設備
金安電鍍股份有限公司,臺中市大雅區雅楓里,股份有限公司,71年,生產中,25金屬製品製造業,254金屬加工處理
哲祥企業社,臺中市烏日區前竹里,有限公司,105年,生產中,25金屬製品製造業,254金屬加工處理、259其他金屬製品
建泰彩藝印刷有限公司,臺北市萬華區華江里,有限公司,109年,生產中,16印刷及資料儲存媒體複製業、16印刷及資料儲存媒體複製業,160印刷及資料儲存媒體複製
建龍機械工業股份有限公司樹林廠,新北市樹林區東山里,股份有限公司,111年,生產中,24基本金屬製造業、25金屬製品製造業、29機械設備製造業,241鋼鐵、242鋁、251金屬刀具、手工具及模具、254金屬加工處理、291金屬加工用機械設備、293通用機械設備
允億金股份有限公司,彰化縣花壇鄉中庄村,股份有限公司,98年,生產中,08食品製造業,083蔬果加工
白雞食品工業開發有限公司,新北市三峽區嘉添里,有限公司,101年,生產中,08食品製造業,083蔬果加工
義益糖?廠,嘉義縣水上鄉龍德村,獨資,80年,生產中,08食品製造業,089其他食品
金意興企業有限公司二廠,彰化縣鹿港鎮溝墘里,有限公司,109年,生產中,25金屬製品製造業,254金屬加工處理
全亮號,彰化縣鹿港鎮菜園里,獨資,59年,生產中,25金屬製品製造業,251金屬刀具、手工具及模具、254金屬加工處理
智勝科技股份有限公司台中廠,臺中市西屯區協和里,股份有限公司,98年,生產中,22塑膠製品製造業、26電子零組件製造業,220塑膠製品、269其他電子零組件
鉅暐科技股份有限公司,臺中市潭子區栗林里,股份有限公司,96年,生產中,25金屬製品製造業、29機械設備製造業,251金屬刀具、手工具及模具、259其他金屬製品、293通用機械設備
有田紙業有限公司,桃園市八德區廣興里,有限公司,109年,生產中,15紙漿、紙及紙製品製造業,152瓦楞紙板及紙容器
喬茂精模工業股份有限公司二廠,臺中市潭子區新田里,股份有限公司,109年,生產中,25金屬製品製造業,251金屬刀具、手工具及模具
亞加迪精密工業有限公司,桃園市八德區高明里,有限公司,110年,生產中,30汽車及其零件製造業,303汽車零件
王子製藥股份有限公司中科廠,雲林縣虎尾鎮墾地里,股份有限公司,109年,生產中,20藥品及醫用化學製品製造業,200藥品及醫用化學製品
鉅昇企業社,高雄市湖內區湖內里,獨資,109年,生產中,25金屬製品製造業,251金屬刀具、手工具及模具
彰益交通器材有限公司,彰化縣埔鹽鄉?子村,有限公司,109年,生產中,29機械設備製造業、30汽車及其零件製造業、31其他運輸工具及其零件製造業,292其他專用機械設備、303汽車零件、311船舶及浮動設施、312機車及其零件、313自行車及其零件、319未分類其他運輸工具及其零件
順昌企業社,桃園市八德區茄苳里,獨資,88年,生產中,29機械設備製造業,293通用機械設備
浤鎰股份有限公司,桃園市蘆竹區海湖里,股份有限公司,107年,生產中,18化學材料及肥料製造業,181化學原材料
富御特能源科技股份有限公司,高雄市大寮區過溪里,股份有限公司,106年,生產中,17石油及煤製品製造業,170石油及煤製品
三口井企業有限公司,彰化縣溪湖鎮東寮里,有限公司,109年,生產中,25金屬製品製造業、29機械設備製造業,259其他金屬製品、292其他專用機械設備
妙昇實業股份有限公司,彰化縣秀水鄉安東村,股份有限公司,77年,生產中,25金屬製品製造業,259其他金屬製品
永奇發有限公司二廠,臺中市豐原區鎌村里,有限公司,109年,生產中,13皮革、毛皮及其製品製造業,130皮革、毛皮及其製品
偉順股份有限公司,臺中市大雅區員林里,股份有限公司,109年,生產中,25金屬製品製造業,251金屬刀具、手工具及模具
裕永實業有限公司,新北市淡水區水源里,有限公司,74年,生產中,25金屬製品製造業、29機械設備製造業,293通用機械設備、251金屬刀具、手工具及模具、259其他金屬製品
國鼎齒輪有限公司,臺中市大里區仁化里,有限公司,109年,生產中,29機械設備製造業,293通用機械設備
盛昌製本有限公司,新北市新莊區西盛里,有限公司,100年,生產中,16印刷及資料儲存媒體複製業,160印刷及資料儲存媒體複製
勝右企業有限公司,彰化縣和美鎮面前里,有限公司,109年,生產中,29機械設備製造業,293通用機械設備
朝裕五金有限公司,彰化縣和美鎮源埤里,有限公司,109年,生產中,25金屬製品製造業,259其他金屬製品
昇侑興業有限公司,桃園市桃園區泰山里,有限公司,92年,生產中,16印刷及資料儲存媒體複製業,160印刷及資料儲存媒體複製
良昌工業社,彰化縣和美鎮嘉犁里,獨資,109年,生產中,25金屬製品製造業、28電力設備及配備製造業、29機械設備製造業,251金屬刀具、手工具及模具、259其他金屬製品、281發電、輸電及配電機械、293通用機械設備
郭元益食品股份有限公司楊梅廠,桃園市楊梅區高山里,股份有限公司,81年,生產中,08食品製造業,089其他食品
銘九股份有限公司,臺中市北區明德里,股份有限公司,94年,生產中,25金屬製品製造業,259其他金屬製品
億昇衛浴有限公司,彰化縣鹿港鎮溝墘里,有限公司,109年,生產中,25金屬製品製造業、29機械設備製造業,259其他金屬製品、293通用機械設備
久源工業有限公司,臺中市烏日區北里里,有限公司,103年,生產中,25金屬製品製造業,259其他金屬製品
焰光有限公司,臺中市東區東門里,有限公司,77年,生產中,25金屬製品製造業、29機械設備製造業、30汽車及其零件製造業、31其他運輸工具及其零件製造業,251金屬刀具、手工具及模具、293通用機械設備、303汽車零件、312機車及其零件
哈林企業股份有限公司甲廠,臺中市西屯區協和里,股份有限公司,78年,生產中,22塑膠製品製造業,220塑膠製品
鑫展銅業股份有限公司,苗栗縣銅鑼鄉銅鑼村,股份有限公司,110年,生產中,24基本金屬製造業,243銅
凱立模型有限公司,新北市三重區永發里,有限公司,85年,生產中,22塑膠製品製造業、29機械設備製造業、25金屬製品製造業,220塑膠製品、293通用機械設備、251金屬刀具、手工具及模具
毅翔機械有限公司,苗栗縣頭份市田寮里,有限公司,110年,生產中,29機械設備製造業,292其他專用機械設備
勤駿興業有限公司,新竹縣竹北市白地里,有限公司,109年,生產中,25金屬製品製造業、25金屬製品製造業,254金屬加工處理
達香食品店,桃園市大溪區員林里,獨資,109年,生產中,08食品製造業,083蔬果加工
岱庚企業有限公司,新北市五股區興珍里,有限公司,83年,生產中,22塑膠製品製造業、25金屬製品製造業、16印刷及資料儲存媒體複製業、33其他製造業,220塑膠製品、251金屬刀具、手工具及模具、160印刷及資料儲存媒體複製、331育樂用品
千溢五金工廠,新北市新莊區西盛里,合夥,109年,生產中,25金屬製品製造業,259其他金屬製品
玉珍齋,彰化縣鹿港鎮中興里,獨資,59年,生產中,08食品製造業,089其他食品
元創精密車業股份有限公司龍潭廠,桃園市龍潭區九龍里,股份有限公司,109年,生產中,30汽車及其零件製造業、31其他運輸工具及其零件製造業,301汽車、312機車及其零件
元品工業股份有限公司二廠,彰化縣秀水鄉鶴鳴村,股份有限公司,109年,生產中,22塑膠製品製造業、25金屬製品製造業,220塑膠製品、259其他金屬製品
集財實業有限公司,彰化縣鹿港鎮詔安里,有限公司,109年,生產中,25金屬製品製造業、32家具製造業,259其他金屬製品、322金屬家具
高嘉塑膠股份有限公司三廠,高雄市湖內區忠興里,股份有限公司,109年,生產中,22塑膠製品製造業,220塑膠製品
泓融股份有限公司二廠,彰化縣彰化市南美里,股份有限公司,109年,生產中,25金屬製品製造業,259其他金屬製品
忠聯興業有限公司,彰化縣線西鄉下犁村,有限公司,58年,生產中,11紡織業,112織布
竣偉有限公司二廠,臺中市大雅區文雅里,有限公司,109年,生產中,25金屬製品製造業,254金屬加工處理
強舜木業有限公司,高雄市梓官區赤崁里,有限公司,109年,生產中,14木竹製品製造業,140木竹製品
勝昱生化科技有限公司二廠,彰化縣社頭鄉廣興村,有限公司,111年,生產中,08食品製造業,087動物飼品
貿?實業社二廠,彰化縣埤頭鄉元埔村,獨資,109年,生產中,25金屬製品製造業,259其他金屬製品
台灣維克法蘭斯股份有限公司,高雄市湖內區田尾里,股份有限公司,101年,生產中,20藥品及醫用化學製品製造業,200藥品及醫用化學製品
德鑫雷射切割股份有限公司,新北市五股區興珍里,股份有限公司,92年,生產中,25金屬製品製造業、29機械設備製造業,259其他金屬製品、293通用機械設備
長驥企業有限公司三廠,臺中市太平區新興里,有限公司,109年,生產中,25金屬製品製造業,259其他金屬製品
統用開發有限公司,臺中市龍井區竹坑里,有限公司,109年,生產中,19其他化學製品製造業,193清潔用品及化粧品
日銪股份有限公司二廠,臺中市豐原區翁子里,股份有限公司,109年,生產中,25金屬製品製造業,254金屬加工處理
銓良企業股份有限公司第三廠,高雄市路竹區後鄉里,股份有限公司,110年,生產中,25金屬製品製造業,259其他金屬製品
進饌製冰有限公司,高雄市大樹區九曲里,有限公司,109年,生產中,08食品製造業,089其他食品
風城製麵有限公司一廠,新北市新店區江陵里,有限公司,95年,生產中,08食品製造業,089其他食品
世楙鋼鐵股份有限公司新吉廠,臺南市安南區佃東里,股份有限公司,111年,生產中,25金屬製品製造業,254金屬加工處理
永利木材行工廠,臺南市新化區北勢里,合夥,109年,生產中,14木竹製品製造業,140木竹製品
順晉實業股份有限公司大園廠,桃園市大園區北港里,股份有限公司,103年,生產中,11紡織業,114染整
長新能源股份有限公司,臺中市大里區大元里,股份有限公司,109年,生產中,33其他製造業,339未分類其他製品
佳乳食品股份有限公司,新竹縣湖口鄉湖南村,股份有限公司,79年,生產中,08食品製造業、09飲料製造業,085乳品、089其他食品、092非酒精飲料
群天企業有限公司,彰化縣線西鄉塭仔村,有限公司,111年,生產中,11紡織業,114染整
暐肯照明有限公司中壢廠,桃園市中壢區文化里,有限公司,98年,生產中,26電子零組件製造業、28電力設備及配備製造業,264光電材料及元件、284照明設備及配備
聯昇企業社三廠,彰化縣埔心鄉埔心村,合夥,109年,生產中,24基本金屬製造業、25金屬製品製造業,241鋼鐵、252金屬結構及建築組件
正新鋁業股份有限公司,桃園市中壢區復興里,股份有限公司,71年,生產中,24基本金屬製造業、25金屬製品製造業,242鋁、252金屬結構及建築組件
慶翔工業有限公司,臺南市安南區,有限公司,93年,生產中,25金屬製品製造業,254金屬加工處理
宏達數碼科技有限公司一廠,新北市汐止區樟樹里,有限公司,109年,生產中,16印刷及資料儲存媒體複製業,160印刷及資料儲存媒體複製
証新精密科技有限公司,臺中市烏日區學田里,有限公司,109年,生產中,25金屬製品製造業,251金屬刀具、手工具及模具
旺鑫工業股份有限公司,臺中市大安區中庄里,股份有限公司,109年,生產中,13皮革、毛皮及其製品製造業,130皮革、毛皮及其製品
昇益五金加工廠,臺南市永康區?行里,獨資,75年,生產中,25金屬製品製造業,259其他金屬製品
弘成實業有限公司二廠,彰化縣線西鄉下犁村,有限公司,109年,生產中,11紡織業,115紡織品
倫達紙器有限公司二廠,彰化縣福興鄉番社村,有限公司,109年,生產中,15紙漿、紙及紙製品製造業,152瓦楞紙板及紙容器、159其他紙製品
興億皮件廠,彰化縣埔鹽鄉永平村,獨資,109年,生產中,12成衣及服飾品製造業,123服飾品
沃康生技股份有限公司,新北市汐止區復興里,股份有限公司,108年,生產中,11紡織業、19其他化學製品製造業、20藥品及醫用化學製品製造業,115紡織品、193清潔用品及化粧品、200藥品及醫用化學製品
旺林金屬表面處理有限公司,新北市新莊區西盛里,有限公司,96年,生產中,25金屬製品製造業,254金屬加工處理
鑫志勝股份有限公司大埔美廠,嘉義縣大林鎮大美里,股份有限公司,107年,生產中,29機械設備製造業,292其他專用機械設備
縉緯企業有限公司二廠,彰化縣秀水鄉埔崙村,有限公司,109年,生產中,25金屬製品製造業、31其他運輸工具及其零件製造業,259其他金屬製品、313自行車及其零件
進吉食品有限公司,新竹縣竹北市聯興里,有限公司,109年,生產中,08食品製造業,081肉類加工
屢鑫有限公司,高雄市阿蓮區玉庫里,有限公司,109年,生產中,25金屬製品製造業,259其他金屬製品
建銘興業有限公司,高雄市岡山區台上里,有限公司,109年,生產中,25金屬製品製造業,259其他金屬製品
祥實食品有限公司,桃園市中壢區內定里,有限公司,110年,生產中,08食品製造業,083蔬果加工
信辰重機械有限公司,桃園市新屋區頭洲里,有限公司,109年,生產中,28電力設備及配備製造業,283電線及配線器材
詠翔焊接網廠有限公司,桃園市新屋區東明里,有限公司,109年,生產中,25金屬製品製造業,259其他金屬製品
晏豐精機有限公司大肚廠,臺中市大肚區中和里,有限公司,109年,生產中,25金屬製品製造業,259其他金屬製品
勤武機械工業有限公司,彰化縣員林市溝皂里,有限公司,62年,生產中,29機械設備製造業,293通用機械設備
欣業企業股份有限公司,嘉義縣竹崎鄉灣橋村,股份有限公司,65年,生產中,32家具製造業、28電力設備及配備製造業、25金屬製品製造業、29機械設備製造業,321非金屬家具、259其他金屬製品、293通用機械設備
順凱實業股份有限公司,桃園市蘆竹區蘆竹里,股份有限公司,64年,生產中,22塑膠製品製造業、11紡織業,220塑膠製品、115紡織品
十方製香廠,臺南市下營區新興里,獨資,109年,生產中,33其他製造業,339未分類其他製品
重盈陽成工業股份有限公司,高雄市楠梓區五常里,股份有限公司,85年,生產中,25金屬製品製造業,254金屬加工處理
潔閎有限公司中壢廠,桃園市中壢區文化里,有限公司,99年,生產中,22塑膠製品製造業,220塑膠製品
集合成環保科技股份有限公司彰濱廠,彰化縣伸港鄉蚵寮村,股份有限公司,91年,生產中,24基本金屬製造業、33其他製造業,249其他基本金屬、339未分類其他製品
上逸食品股份有限公司,雲林縣斗六市榴中里,股份有限公司,104年,生產中,08食品製造業,081肉類加工、082水產加工、089其他食品
偉家企業社,新竹市香山區中埔里,獨資,109年,生產中,09飲料製造業,092非酒精飲料
梧翔企業有限公司,臺南市永康區尚頂里,有限公司,80年,生產中,25金屬製品製造業,251金屬刀具、手工具及模具
鳳業耐酸機材工業有限公司新莊廠,新北市新莊區福興里,有限公司,80年,生產中,25金屬製品製造業、29機械設備製造業,259其他金屬製品、293通用機械設備
藝格科技有限公司新莊廠,新北市新莊區福基里,有限公司,94年,生產中,29機械設備製造業、25金屬製品製造業,293通用機械設備、251金屬刀具、手工具及模具
鑫昌勝工業有限公司,彰化縣彰化市萬安里,有限公司,86年,生產中,25金屬製品製造業、29機械設備製造業,259其他金屬製品、293通用機械設備
世家機械有限公司,桃園市八德區茄苳里,有限公司,94年,生產中,24基本金屬製造業、25金屬製品製造業,241鋼鐵、252金屬結構及建築組件
聯泰紡織有限公司,彰化縣和美鎮仁愛里,有限公司,107年,生產中,11紡織業,112織布
建暐精密科技股份有限公司,高雄市鳳山區鎮北里,股份有限公司,79年,生產中,29機械設備製造業、26電子零組件製造業、27電腦、電子產品及光學製品製造業,291金屬加工用機械設備、293通用機械設備、292其他專用機械設備、269其他電子零組件、277光學儀器及設備、275量測、導航、控制設備及鐘錶
傑承工程有限公司,雲林縣斗南鎮田頭里,有限公司,108年,生產中,25金屬製品製造業,252金屬結構及建築組件
理全企業股份有限公司,臺中市西屯區協和里,有限公司,88年,生產中,25金屬製品製造業、29機械設備製造業,251金屬刀具、手工具及模具、293通用機械設備
協慶鋼鐵有限公司,臺南市南區建南里,有限公司,109年,生產中,30汽車及其零件製造業,303汽車零件
晁陞有限公司,桃園市大溪區瑞源里,有限公司,109年,生產中,29機械設備製造業,293通用機械設備
欣原金屬有限公司,臺中市龍井區忠和里,有限公司,109年,生產中,25金屬製品製造業,254金屬加工處理
應元化學製藥股份有限公司,臺南市南區彰南里,股份有限公司,70年,生產中,20藥品及醫用化學製品製造業,200藥品及醫用化學製品
華龍電業股份有限公司三重廠,新北市三重區中興里,股份有限公司,109年,生產中,22塑膠製品製造業、28電力設備及配備製造業,220塑膠製品、281發電、輸電及配電機械、283電線及配線器材
旺泰股份有限公司,桃園市平鎮區東勢里,股份有限公司,109年,生產中,23非金屬礦物製品製造業,239其他非金屬礦物製品
群承企業有限公司,臺南市關廟區埤頭里,有限公司,109年,生產中,30汽車及其零件製造業、31其他運輸工具及其零件製造業,303汽車零件、312機車及其零件
美和浪板型鋼廠第二廠,雲林縣莿桐鄉義和村,獨資,109年,生產中,25金屬製品製造業,259其他金屬製品
創建建築科技有限公司,臺中市大雅區雅楓里,有限公司,109年,生產中,25金屬製品製造業,252金屬結構及建築組件
順智企業有限公司,新北市樹林區三龍里,有限公司,111年,生產中,19其他化學製品製造業,193清潔用品及化粧品
立居富股份有限公司二廠,彰化縣鹿港鎮頂番里,股份有限公司,109年,生產中,25金屬製品製造業、29機械設備製造業,259其他金屬製品、293通用機械設備
富欣山實業社,彰化縣福興鄉社尾村,獨資,109年,生產中,25金屬製品製造業,259其他金屬製品
彰振特殊鋼材有限公司,彰化縣秀水鄉馬興村,有限公司,109年,生產中,25金屬製品製造業,254金屬加工處理
通佑塑膠科技有限公司,臺中市烏日區北里里,有限公司,109年,生產中,21橡膠製品製造業、22塑膠製品製造業,210橡膠製品、220塑膠製品
鴻維羽毛實業股份有限公司,彰化縣二林鎮華崙里,股份有限公司,108年,生產中,08食品製造業,087動物飼品
錦鋒企業股份有限公司龜山廠,桃園市龜山區大坑里,股份有限公司,89年,生產中,29機械設備製造業、25金屬製品製造業,293通用機械設備、259其他金屬製品
盛弘精密工業股份有限公司,新北市土城區員仁里,股份有限公司,109年,生產中,25金屬製品製造業,254金屬加工處理
嘉聯益科技股份有限公司樹林廠,新北市樹林區樹東里,股份有限公司,96年,生產中,26電子零組件製造業,263印刷電路板
大原企業社,臺南市仁德區土庫里,合夥,90年,生產中,25金屬製品製造業,251金屬刀具、手工具及模具
台灣鍏達實業有限公司,新北市金山區美田里,有限公司,111年,生產中,13皮革、毛皮及其製品製造業、22塑膠製品製造業,130皮革、毛皮及其製品、220塑膠製品
副順鋼模有限公司,新北市蘆洲區得仁里,有限公司,109年,生產中,25金屬製品製造業,251金屬刀具、手工具及模具
聖州企業股份有限公司社皮廠,屏東縣萬丹鄉上村村,股份有限公司,109年,生產中,22塑膠製品製造業、11紡織業、30汽車及其零件製造業,220塑膠製品、115紡織品、303汽車零件
銘隆興業有限公司,臺中市神岡區圳前里,有限公司,109年,生產中,14木竹製品製造業、32家具製造業,140木竹製品、321非金屬家具
大楹數位健康生活有限公司鳳山廠,高雄市鳳山區鎮北里,有限公司,111年,生產中,11紡織業,115紡織品
?辰企業有限公司大同廠,高雄市大寮區大寮里,有限公司,109年,生產中,25金屬製品製造業、27電腦、電子產品及光學製品製造業,254金屬加工處理、272通訊傳播設備
高林國際企業有限公司,彰化縣埤頭鄉大湖村,有限公司,107年,生產中,22塑膠製品製造業,220塑膠製品
浤達股份有限公司,彰化縣鹿港鎮海埔里,股份有限公司,93年,生產中,25金屬製品製造業,254金屬加工處理
